{
  "id": "seq_demo_reporter",
  "organization_id": "org_demo",
  "name": "Reporter plasmid backbone",
  "molecule_type": "dna",
  "topology": "circular",
  "length": 5384,
  "features": [
    {
      "name": "CMV promoter",
      "start": 104,
      "end": 681,
      "kind": "promoter"
    },
    {
      "name": "GFP",
      "start": 920,
      "end": 1639,
      "kind": "CDS"
    }
  ],
  "created_at": "2026-05-10T00:00:00Z",
  "updated_at": "2026-05-10T00:00:00Z"
}
